<?xml version="1.0" encoding="UTF-8" standalone="yes"?>
<roadNavigationSystem xmlns:xsi="http://www.w3.org/2001/XMLSchema-instance" xsi:noNamespaceSchemaLocation="/xsd/rnsInfo.xsd">
    <place capacity="1" id="Gate1">
        <gate>OUT</gate>
    </place>
    <place capacity="2" id="Gate2">
        <nextPlace>SS1-S0</nextPlace>
        <gate>INOUT</gate>
    </place>
    <place capacity="1" id="Gate0">
        <nextPlace>SS0-S0</nextPlace>
        <gate>IN</gate>
    </place>
    <place capacity="45" id="PA001">
        <nextPlace>SS0-S5</nextPlace>
        <parkingArea/>
    </place>
    <place capacity="45" id="PA000">
        <nextPlace>SS0-S0</nextPlace>
        <parkingArea>
            <service>Toilet</service>
        </parkingArea>
    </place>
    <place capacity="15" id="PA002">
        <nextPlace>SS1-S1</nextPlace>
        <parkingArea/>
    </place>
    <place capacity="18" id="PA004">
        <nextPlace>SS1-S4</nextPlace>
        <parkingArea>
            <service>Restaurant</service>
            <service>Toilet</service>
            <service>Bar</service>
        </parkingArea>
    </place>
    <place capacity="36" id="PA003">
        <nextPlace>SS1-S3</nextPlace>
        <parkingArea>
            <service>Toilet</service>
            <service>Bar</service>
        </parkingArea>
    </place>
    <place capacity="40" id="SS0-S0">
        <nextPlace>PA000</nextPlace>
        <nextPlace>SS0-S1</nextPlace>
        <roadSegment name="S0" road="SS0"/>
    </place>
    <place capacity="46" id="SS0-S2">
        <nextPlace>SS0-S3</nextPlace>
        <roadSegment name="S2" road="SS0"/>
    </place>
    <place capacity="46" id="SS0-S7">
        <nextPlace>Gate2</nextPlace>
        <roadSegment name="S7" road="SS0"/>
    </place>
    <place capacity="17" id="SS0-S6">
        <nextPlace>SS0-S7</nextPlace>
        <roadSegment name="S6" road="SS0"/>
    </place>
    <place capacity="10" id="SS0-S5">
        <nextPlace>PA001</nextPlace>
        <nextPlace>SS0-S6</nextPlace>
        <roadSegment name="S5" road="SS0"/>
    </place>
    <place capacity="48" id="SS1-S5">
        <nextPlace>SS1-S6</nextPlace>
        <roadSegment name="S5" road="SS1"/>
    </place>
    <place capacity="24" id="SS1-S7">
        <nextPlace>Gate1</nextPlace>
        <roadSegment name="S7" road="SS1"/>
    </place>
    <place capacity="41" id="SS0-S4">
        <nextPlace>SS0-S5</nextPlace>
        <roadSegment name="S4" road="SS0"/>
    </place>
    <place capacity="10" id="SS1-S1">
        <nextPlace>PA002</nextPlace>
        <nextPlace>SS1-S2</nextPlace>
        <roadSegment name="S1" road="SS1"/>
    </place>
    <place capacity="31" id="SS1-S4">
        <nextPlace>PA004</nextPlace>
        <nextPlace>SS1-S5</nextPlace>
        <roadSegment name="S4" road="SS1"/>
    </place>
    <place capacity="20" id="SS0-S1">
        <nextPlace>SS0-S2</nextPlace>
        <roadSegment name="S1" road="SS0"/>
    </place>
    <place capacity="12" id="SS1-S6">
        <nextPlace>SS1-S7</nextPlace>
        <roadSegment name="S6" road="SS1"/>
    </place>
    <place capacity="28" id="SS0-S3">
        <nextPlace>SS0-S4</nextPlace>
        <roadSegment name="S3" road="SS0"/>
    </place>
    <place capacity="28" id="SS1-S2">
        <nextPlace>SS1-S3</nextPlace>
        <roadSegment name="S2" road="SS1"/>
    </place>
    <place capacity="24" id="SS1-S0">
        <nextPlace>SS1-S1</nextPlace>
        <roadSegment name="S0" road="SS1"/>
    </place>
    <place capacity="15" id="SS1-S3">
        <nextPlace>PA003</nextPlace>
        <nextPlace>SS1-S4</nextPlace>
        <roadSegment name="S3" road="SS1"/>
    </place>
    <connection from="SS1-S1" to="PA002"/>
    <connection from="SS0-S7" to="Gate2"/>
    <connection from="SS0-S5" to="PA001"/>
    <connection from="Gate0" to="SS0-S0"/>
    <connection from="SS1-S3" to="PA003"/>
    <connection from="SS0-S4" to="SS0-S5"/>
    <connection from="SS0-S2" to="SS0-S3"/>
    <connection from="SS1-S4" to="PA004"/>
    <connection from="SS1-S1" to="SS1-S2"/>
    <connection from="SS1-S6" to="SS1-S7"/>
    <connection from="SS1-S0" to="SS1-S1"/>
    <connection from="SS0-S5" to="SS0-S6"/>
    <connection from="SS1-S7" to="Gate1"/>
    <connection from="PA000" to="SS0-S0"/>
    <connection from="SS1-S3" to="SS1-S4"/>
    <connection from="SS1-S5" to="SS1-S6"/>
    <connection from="Gate2" to="SS1-S0"/>
    <connection from="PA002" to="SS1-S1"/>
    <connection from="SS1-S2" to="SS1-S3"/>
    <connection from="SS0-S1" to="SS0-S2"/>
    <connection from="PA004" to="SS1-S4"/>
    <connection from="PA001" to="SS0-S5"/>
    <connection from="SS0-S6" to="SS0-S7"/>
    <connection from="PA003" to="SS1-S3"/>
    <connection from="SS0-S0" to="SS0-S1"/>
    <connection from="SS1-S4" to="SS1-S5"/>
    <connection from="SS0-S3" to="SS0-S4"/>
    <connection from="SS0-S0" to="PA000"/>
</roadNavigationSystem>
