<?xml version="1.0" encoding="UTF-8" standalone="yes"?>
<roadNavigationSystem xmlns:xsi="http://www.w3.org/2001/XMLSchema-instance" xsi:noNamespaceSchemaLocation="/xsd/rnsInfo.xsd">
    <place capacity="1" id="Gate1">
        <gate>OUT</gate>
    </place>
    <place capacity="2" id="Gate2">
        <nextPlace>A1-S0</nextPlace>
        <gate>INOUT</gate>
    </place>
    <place capacity="1" id="Gate0">
        <nextPlace>A0-S0</nextPlace>
        <gate>IN</gate>
    </place>
    <place capacity="26" id="PA000">
        <nextPlace>A1-S0</nextPlace>
        <parkingArea>
            <service>Restaurant</service>
        </parkingArea>
    </place>
    <place capacity="18" id="A0-S0">
        <nextPlace>A0-S1</nextPlace>
        <roadSegment name="S0" road="A0"/>
    </place>
    <place capacity="14" id="A1-S5">
        <nextPlace>Gate1</nextPlace>
        <roadSegment name="S5" road="A1"/>
    </place>
    <place capacity="12" id="A1-S3">
        <nextPlace>A1-S4</nextPlace>
        <roadSegment name="S3" road="A1"/>
    </place>
    <place capacity="46" id="A1-S4">
        <nextPlace>A1-S5</nextPlace>
        <roadSegment name="S4" road="A1"/>
    </place>
    <place capacity="12" id="A0-S1">
        <nextPlace>A0-S2</nextPlace>
        <roadSegment name="S1" road="A0"/>
    </place>
    <place capacity="11" id="A1-S1">
        <nextPlace>A1-S2</nextPlace>
        <roadSegment name="S1" road="A1"/>
    </place>
    <place capacity="15" id="A1-S0">
        <nextPlace>PA000</nextPlace>
        <nextPlace>A1-S1</nextPlace>
        <roadSegment name="S0" road="A1"/>
    </place>
    <place capacity="25" id="A1-S2">
        <nextPlace>A1-S3</nextPlace>
        <roadSegment name="S2" road="A1"/>
    </place>
    <place capacity="27" id="A0-S2">
        <nextPlace>Gate2</nextPlace>
        <roadSegment name="S2" road="A0"/>
    </place>
    <connection from="A1-S5" to="Gate1"/>
    <connection from="A1-S0" to="A1-S1"/>
    <connection from="Gate0" to="A0-S0"/>
    <connection from="PA000" to="A1-S0"/>
    <connection from="A1-S2" to="A1-S3"/>
    <connection from="A1-S4" to="A1-S5"/>
    <connection from="A1-S0" to="PA000"/>
    <connection from="A1-S1" to="A1-S2"/>
    <connection from="A0-S0" to="A0-S1"/>
    <connection from="A0-S1" to="A0-S2"/>
    <connection from="A0-S2" to="Gate2"/>
    <connection from="A1-S3" to="A1-S4"/>
    <connection from="Gate2" to="A1-S0"/>
</roadNavigationSystem>
