<?xml version="1.0" encoding="UTF-8" standalone="yes"?>
<roadNavigationSystem xmlns:xsi="http://www.w3.org/2001/XMLSchema-instance" xsi:noNamespaceSchemaLocation="/xsd/rnsInfo.xsd">
    <place capacity="1" id="Gate1">
        <gate>OUT</gate>
    </place>
    <place capacity="2" id="Gate2">
        <nextPlace>A0-S0</nextPlace>
        <gate>INOUT</gate>
    </place>
    <place capacity="1" id="Gate0">
        <nextPlace>SS0-S0</nextPlace>
        <gate>IN</gate>
    </place>
    <place capacity="24" id="PA001">
        <nextPlace>A0-S6</nextPlace>
        <parkingArea>
            <service>Restaurant</service>
        </parkingArea>
    </place>
    <place capacity="24" id="PA000">
        <nextPlace>SS0-S0</nextPlace>
        <parkingArea>
            <service>Bar</service>
        </parkingArea>
    </place>
    <place capacity="19" id="SS0-S0">
        <nextPlace>PA000</nextPlace>
        <nextPlace>SS0-S1</nextPlace>
        <roadSegment name="S0" road="SS0"/>
    </place>
    <place capacity="35" id="SS0-S1">
        <nextPlace>SS0-S2</nextPlace>
        <roadSegment name="S1" road="SS0"/>
    </place>
    <place capacity="30" id="SS0-S2">
        <nextPlace>Gate2</nextPlace>
        <roadSegment name="S2" road="SS0"/>
    </place>
    <place capacity="37" id="A0-S5">
        <nextPlace>A0-S6</nextPlace>
        <roadSegment name="S5" road="A0"/>
    </place>
    <place capacity="15" id="A0-S6">
        <nextPlace>PA001</nextPlace>
        <nextPlace>Gate1</nextPlace>
        <roadSegment name="S6" road="A0"/>
    </place>
    <place capacity="49" id="A0-S3">
        <nextPlace>A0-S4</nextPlace>
        <roadSegment name="S3" road="A0"/>
    </place>
    <place capacity="18" id="A0-S4">
        <nextPlace>A0-S5</nextPlace>
        <roadSegment name="S4" road="A0"/>
    </place>
    <place capacity="43" id="A0-S1">
        <nextPlace>A0-S2</nextPlace>
        <roadSegment name="S1" road="A0"/>
    </place>
    <place capacity="11" id="A0-S2">
        <nextPlace>A0-S3</nextPlace>
        <roadSegment name="S2" road="A0"/>
    </place>
    <place capacity="43" id="A0-S0">
        <nextPlace>A0-S1</nextPlace>
        <roadSegment name="S0" road="A0"/>
    </place>
    <connection from="A0-S0" to="A0-S1"/>
    <connection from="Gate0" to="SS0-S0"/>
    <connection from="SS0-S1" to="SS0-S2"/>
    <connection from="Gate2" to="A0-S0"/>
    <connection from="A0-S2" to="A0-S3"/>
    <connection from="A0-S4" to="A0-S5"/>
    <connection from="A0-S6" to="PA001"/>
    <connection from="A0-S6" to="Gate1"/>
    <connection from="A0-S1" to="A0-S2"/>
    <connection from="SS0-S0" to="SS0-S1"/>
    <connection from="SS0-S2" to="Gate2"/>
    <connection from="PA001" to="A0-S6"/>
    <connection from="A0-S3" to="A0-S4"/>
    <connection from="SS0-S0" to="PA000"/>
    <connection from="A0-S5" to="A0-S6"/>
    <connection from="PA000" to="SS0-S0"/>
</roadNavigationSystem>
