<?xml version="1.0" encoding="UTF-8" standalone="yes"?>
<roadNavigationSystem xmlns:xsi="http://www.w3.org/2001/XMLSchema-instance" xsi:noNamespaceSchemaLocation="/xsd/rnsInfo.xsd">
    <place capacity="1" id="Gate1">
        <gate>OUT</gate>
    </place>
    <place capacity="2" id="Gate2">
        <gate>INOUT</gate>
    </place>
    <place capacity="1" id="Gate0">
        <gate>IN</gate>
    </place>
    <place capacity="19" id="PA002">
        <parkingArea>
            <service>Restaurant</service>
        </parkingArea>
    </place>
    <place capacity="46" id="PA001">
        <parkingArea>
            <service>Toilet</service>
            <service>Bar</service>
        </parkingArea>
    </place>
    <place capacity="30" id="PA000">
        <parkingArea>
            <service>Restaurant</service>
            <service>Toilet</service>
            <service>Bar</service>
        </parkingArea>
    </place>
    <place capacity="28" id="SS0-S0">
        <roadSegment name="S0" road="SS0"/>
    </place>
    <place capacity="32" id="SS0-S8">
        <roadSegment name="S8" road="SS0"/>
    </place>
    <place capacity="10" id="SS0-S9">
        <roadSegment name="S9" road="SS0"/>
    </place>
    <place capacity="27" id="A0-S6">
        <roadSegment name="S6" road="A0"/>
    </place>
    <place capacity="12" id="SS0-S1">
        <roadSegment name="S1" road="SS0"/>
    </place>
    <place capacity="50" id="SS0-S6">
        <roadSegment name="S6" road="SS0"/>
    </place>
    <place capacity="31" id="SS0-S7">
        <roadSegment name="S7" road="SS0"/>
    </place>
    <place capacity="21" id="SS0-S2">
        <roadSegment name="S2" road="SS0"/>
    </place>
    <place capacity="10" id="A0-S5">
        <roadSegment name="S5" road="A0"/>
    </place>
    <place capacity="31" id="A0-S3">
        <roadSegment name="S3" road="A0"/>
    </place>
    <place capacity="36" id="SS0-S5">
        <roadSegment name="S5" road="SS0"/>
    </place>
    <place capacity="48" id="A0-S7">
        <roadSegment name="S7" road="A0"/>
    </place>
    <place capacity="40" id="SS0-S3">
        <roadSegment name="S3" road="SS0"/>
    </place>
    <place capacity="23" id="SP0-S0">
        <roadSegment name="S0" road="SP0"/>
    </place>
    <place capacity="18" id="A0-S0">
        <roadSegment name="S0" road="A0"/>
    </place>
    <place capacity="50" id="SS0-S4">
        <roadSegment name="S4" road="SS0"/>
    </place>
    <place capacity="28" id="A0-S1">
        <roadSegment name="S1" road="A0"/>
    </place>
    <place capacity="43" id="A0-S4">
        <roadSegment name="S4" road="A0"/>
    </place>
    <place capacity="30" id="A0-S2">
        <roadSegment name="S2" road="A0"/>
    </place>
    <connection from="PA002" to="SS0-S9"/>
    <connection from="PA000" to="SS0-S6"/>
    <connection from="SP0-S0" to="Gate2"/>
    <connection from="Gate0" to="SS0-S0"/>
    <connection from="A0-S1" to="A0-S2"/>
    <connection from="SS0-S8" to="SS0-S9"/>
    <connection from="A0-S2" to="A0-S3"/>
    <connection from="SS0-S0" to="SS0-S1"/>
    <connection from="Gate2" to="A0-S0"/>
    <connection from="SS0-S5" to="SS0-S6"/>
    <connection from="Gate0" to="SP0-S0"/>
    <connection from="SS0-S7" to="SS0-S8"/>
    <connection from="A0-S6" to="A0-S7"/>
    <connection from="SS0-S4" to="SS0-S5"/>
    <connection from="SS0-S7" to="PA001"/>
    <connection from="SS0-S6" to="SS0-S7"/>
    <connection from="A0-S7" to="Gate1"/>
    <connection from="SS0-S9" to="Gate1"/>
    <connection from="A0-S0" to="A0-S1"/>
    <connection from="A0-S4" to="A0-S5"/>
    <connection from="PA001" to="SS0-S7"/>
    <connection from="SS0-S9" to="PA002"/>
    <connection from="SS0-S3" to="SS0-S4"/>
    <connection from="SS0-S6" to="PA000"/>
    <connection from="SS0-S1" to="SS0-S2"/>
    <connection from="A0-S5" to="A0-S6"/>
    <connection from="SS0-S2" to="SS0-S3"/>
    <connection from="A0-S3" to="A0-S4"/>
</roadNavigationSystem>
